{"failure":null,"invocationDigest":"1360b18ce346ca9e0495d027940088fba45f658a674f5e4b4419e9e8bf6136fd","outcome":{"campaignInvocation":{"digest":"b4383b935391259bb9f36554f0dfb57b230a8afeaebd398589a0916a1318b090","role":"cache-campaign-invocation"},"campaignStatus":"complete","exclusions":{"error":0,"timeout":0,"unknown":0},"kind":"derived","scheduleMode":"first-kill","scheduledButUnexecuted":["mutant-comparison-t1-o1","mutant-execution-t2","mutant-comparison-t2-o0"],"score":{"denominator":1,"killed":1,"ratio":{"denominator":1,"numerator":1},"survived":0},"selectedRecords":[{"recordId":"9632e3e25c05a5c0086a72c4cfbe2700a0b29d12a13802fa7c4b5074dd417b2a","slotId":"baseline-execution-t1"},{"recordId":"e60a0dba69099caecd366c636e4d41d4577b8193ec218c3b416b442e659663de","slotId":"baseline-gate-t1-o0"},{"recordId":"f9db32022c551efb5e012eda37a9823c83408cf87d7094179f684069c460958f","slotId":"baseline-gate-t1-o1"},{"recordId":"5cd77fb0469de61e8c70b18457fb177e667ec582f15f1bf707b3654ff6d61c3c","slotId":"baseline-execution-t2"},{"recordId":"41b14168ef67439be758fc6ee67eb974bbb6f53664e1680899c499e038633c25","slotId":"baseline-gate-t2-o0"},{"recordId":"e06f2c540c45824d0bde3bc1655dfbd59124a969e90f70b2a24df43a27295521","slotId":"mutant-execution-t1"},{"recordId":"b013379178a2cb1e6273258cfa7277db86091ede5f1115a6d50078b2f660ef50","slotId":"mutant-comparison-t1-o0"}],"testStatuses":[{"slotId":"baseline-execution-t1","status":"executed"},{"slotId":"baseline-gate-t1-o0","status":"accepted"},{"slotId":"baseline-gate-t1-o1","status":"accepted"},{"slotId":"baseline-execution-t2","status":"executed"},{"slotId":"baseline-gate-t2-o0","status":"accepted"},{"slotId":"mutant-execution-t1","status":"executed"},{"slotId":"mutant-comparison-t1-o0","status":"kill"},{"slotId":"mutant-comparison-t1-o1","status":"skipped"},{"slotId":"mutant-execution-t2","status":"skipped"},{"slotId":"mutant-comparison-t2-o0","status":"skipped"}]},"resultId":"4a6d0a535abf6da5cfe01468bf270145a87aaacad3103fa83f4ecf96622f0a01","schemaVersion":1}